id,title,subtitle,authors,categories,thumbnail,description,published_year,average_rating,num_pages
1,The Irish Anatomist,A Study of Flann O'Brien,Keith Donohue,Biography & Autobiography,http://books.google.com/books/content?id=baEJAAAACAAJ&printsec=frontcover&img=1&zoom=1&source=gbs_api,"The most full length critical and biographical studies of Flann O'Brien(the nom de plume of Brian O' Nolan an otherwise inoffensive Irish public servant) tend to push asid e the leviathan of Cruiskeen Lawn, a commodious, encyclopedic work of some two million words and focus instead on his novels in English. Dr. Donohue in this important new study considers all of O'Nolan's work including college writings, letters to the editor(raised to a form of national genius by F O'B.) and works in Irish. It draws upon the research and biographical material of Anthony Cronin's No Laughing Matter, along with new research and criticism and takes issue with some of the conclusions reached in Keith Hopper's A Portrait of a Postmodernist. By tracing O'Nolan's development as an artist over time, this new study uncovers the relentless anatomist and post modernist in Flann O'Brien, a man of genius dissecting and exposing life and custom in mid 20th century Dublin. O'Nolan's views on the arts and the novel are carefully discussed along with his relation to the literary Ireland of the deValera years.",2002,5,222
2,Fanning the Flame,"Bible, Cross & Mission : Meeting the Challenge in a Changing World",Christopher J. H. Wright,Religion,http://books.google.com/books/content?id=U-tpkgEACAAJ&printsec=frontcover&img=1&zoom=1&source=gbs_api,"The Bible, the cross, and the mission – by leading members of the evangelical Anglicans.",2003,5,336
3,Harry Potter,"5 Years of Magic, Adventure, and Mystery at Hogwarts",J. K. Rowling,Juvenile Fiction,http://books.google.com/books/content?id=DAAAAAAACAAJ&printsec=frontcover&img=1&zoom=1&source=gbs_api,"The first five years of Harry Potter magic are captured in a boxed set which includes The Sorcerer's Stone, The Chamber of Secrets, The Prisoner of Azkaban, The Goblet of Fire, and The Order of the Phoenix. Simultaneous.",2004,4.78,2690
4,The Harry Potter Collection,The First Six Spellbinding Adventures at Hogwarts,J. K. Rowling,Juvenile Fiction,http://books.google.com/books/content?id=v0z1PQAACAAJ&printsec=frontcover&img=1&zoom=1&source=gbs_api,"The first six years of Harry Potter magic are captured in a boxed set which includes The Sorcerer's Stone, The Chamber of Secrets, The Prisoner of Azkaban, The Goblet of Fire, The Order of the Phoenix, and The Half-Blood Prince.",2005,4.73,3342
5,The Price of the Ticket,"Collected Nonfiction, 1948-1985",James Baldwin,Literary Criticism,http://books.google.com/books/content?id=VbkZxwEACAAJ&printsec=frontcover&img=1&zoom=1&source=gbs_api,"The works of James Baldwin constitute one of the major contributions to American literature in the twentieth century, and nowhere is this more evident than in The Price of the Ticket, a compendium of nearly fifty years of Baldwin's powerful nonfiction writing. With truth and insight, these personal, prophetic works speak to the heart of the experience of race and identity in the United States. Here are the full texts of Notes of a Native Son, Nobody Knows My Name, The Fire Next Time, No Name in the Street, and The Devil Finds Work, along with dozens of other pieces, ranging from a 1948 review of Raintree Country to a magnificent introduction to this book that, as so many of Mr. Baldwin's works do, combines his intensely private experience with the deepest examination of social interaction between the races. In a way, The Price of the Ticket is an intellectual history of the twentieth-century American experience; in another, it is autobiography of the highest order.",1985,4.7,712
6,Restless Till We Rest in You,60 Reflections from the Writings of St. Augustine,"Saint Augustine, Bishop of Hippo;Thomas Paul Thigpen",Religion,http://books.google.com/books/content?id=nREGAAAACAAJ&printsec=frontcover&img=1&zoom=1&source=gbs_api,"""Restless Till We Rest in You"" features spiritual pearls from the works of St. Augustine (354-430 A.D.), including his ""Confessions"" and ""The City of God"", as well as rich insights from his homilies, especially those based on John's Gospel and epistles. As part of the ""Saints Speak Today Series"", this title features 60 daily readings, along with scripture passages and hymns.",1998,4.67,158
7,The Hobbit / The Lord of the Rings,The Hobbit / The Fellowship of the Ring / The Two Towers / The Return of the King,John Ronald Reuel Tolkien,Fiction,http://books.google.com/books/content?id=rW9cLwEACAAJ&printsec=frontcover&img=1&zoom=1&source=gbs_api,"Presents a box set including the complete ""Lord of the Rings"" trilogy, as well as its prequel, ""The Hobbit.""",2012,4.59,1728
8,Simple Acts of Faith,Heartwarming Stories of One Life Touching Another,Margaret Feinberg,Religion,http://books.google.com/books/content?id=hSnhJMi6TiQC&printsec=frontcover&img=1&zoom=1&source=gbs_api,"The beloved art of Normal Rockwell chronicles small-town America and reflects the simple kindnesses that paint ordinary life with shades of the extraordinary. This gathering of select Rockwell classics is joined by stories that illuminate acts of goodwill that transformed people's lives: A cycle shop owner gives Lance Armstrong his first bike, and the rest is history. The young, hurting Frank Peretti is shown compassion that opens up his heart. One man's sharing of faith changed the life of shoe salesman Dwight L. Moody. Norman Rockwell fans, Americana collectors, and those who cherish an uplifting look at life will treasure this celebration of family, community, and the goodness that overflows from the simplest acts of faith.",2003,4.55,48
9,Reader's digest complete guide to the Bible,an illustrated book-by-book companion to the Scriptures,Reader's Digest,Religion,http://books.google.com/books/content?id=DOgJAQAAMAAJ&printsec=frontcover&img=1&zoom=1&source=gbs_api,"Gathers background information about each chapter of the Bible, explains unfamiliar words and phrases, and includes a timeline of Biblical events",1998,4.55,448
10,Disney's Little Einstein,Mission: Where's June?,Susan Ring,Juvenile Fiction,http://books.google.com/books/content?id=0BNTtAEACAAJ&printsec=frontcover&img=1&zoom=1&source=gbs_api,"Leo, Quincy, Annie, and Rocket travel the world to find where June is hiding.",2006,4.55,24
11,Life Management for Busy Women,Growth and study guide,Elizabeth George,Religion,http://books.google.com/books/content?id=OdeIjgEACAAJ&printsec=frontcover&img=1&zoom=1&source=gbs_api,"Women eager to bring simplicity to their busy lives will embrace the principles presented in this exciting study guide based on Elizabeth George's new Life Management for Busy Women. With clear and inspired steps for women eager to become better stewards of their time and their lives, this study guide complements all the major sections of the book, including: Spiritual Life: first things first Home Life: minding the stewardship of place Mental Life: minding your mind Easily adaptable to individual or group study, Life Management for Busy Women Growth and Study Guide will help women of all ages, in all stages of life, learn to see and follow God's blueprint for their lives.",2002,4.54,166
12,The Valley of Vision,A Collection of Puritan Prayers and Devotions,Arthur Bennett,Religion,http://books.google.com/books/content?id=RJ54MKLeQ3YC&printsec=frontcover&img=1&zoom=1&source=gbs_api,"The strength of Puritan character and life lay in prayer and meditation. In this practice the spirit of prayer was regarded as of first importance and the best form of prayer, for living prayer is the characteristic of genuine spirituality. Yet prayer is also vocal and may therefore on occasions be written. Consequently in the Puritan tradition there are many written prayers and meditations which constitute an important corpus of inspiring devotional literature. From this source, Arthur Bennett has distilled the essence of many prayers and set out in modern form what he calls ""aspiration units, the several parts of which could become springboards for the individual's own prayer subjects."" - Back cover.",1975,4.53,223
13,Transcending the Levels of Consciousness,The Stairway of Enlightenment,David R. Hawkins,Religion,http://books.google.com/books/content?id=kXImmwEACAAJ&printsec=frontcover&img=1&zoom=1&source=gbs_api,"Explores the ego's expressions and inherent limitations and gives detailed explanations and instructions on how to transcend them. It expands the understanding of the levels of consciousness as presented in the wiedely-acclaimed Map of Consciousness. The book focuses on the individual, and studies the experiential subjective blocks to the advancement of awareness, at each level of consciousness. This leads to progressive spiritual awareness and on to higher levels of consciousness, providing specific steps for transcending each level, preparatory to advanced states such as Enlightenment itself. By analyzing the various obstacles and levels to be transcended, certain principles that support spiritual evolution are self-revealing. This book si therefore a practical manual rather than a comprehensive analysis.",2005,4.53,407
14,The Lord of the Rings,Weapons and Warfare,Chris Smith,Literary Criticism,http://books.google.com/books/content?id=Wu8x5MNS1rAC&printsec=frontcover&img=1&zoom=1&source=gbs_api,"Describes in detail, with over one thousand photographs, the battles, armies, and armor used in the War of the Ring based on J.R.R. Tolkien's ""Lord of the Rings"" trilogy, including battle plans and character histories and descriptions.",2003,4.53,218
15,The Lord of the Rings,The Two Towers : Visual Companion,Jude Fisher,Fiction,http://books.google.com/books/content?id=_2qFvgEACAAJ&printsec=frontcover&img=1&zoom=1&source=gbs_api,"Explores the people, places, and ideas found in the motion picture adaptation of the second part of J.R.R. Tolkien's ""The Lord of the Rings.""",2002,4.51,72
16,I Am that,Talks with Sri Nisargadatta Maharaj,Sri Nisargadatta Maharaj;Sudhakar S. Dikshit,Philosophy,http://books.google.com/books/content?id=Fv_JPQAACAAJ&printsec=frontcover&img=1&zoom=1&source=gbs_api,"This collection of the timeless teachings of one of the greatest sages of India, is a testament to the uniqueness of the seer's life and work. The book (now in its ninth printing) continues to draw new audiences and to enlighten anxious seekers for self-realisation. Sri Nisargadatta Maharaj was a teacher who did not propound any ideology or religion but gently unwrapped the mystery of the self. His message is simple, direct and yet sublime. The book preserves his dialogues with the followers who came from around the world seeking guidance in destroying false identities. The sage's sole concern was with human suffering and the ending of suffering. It was his mission to guide the individual to an understanding of his true nature and the timelessness of being. He taught that mind must recognise and penetrate its own state of being, not 'being this or that, here or there, then or now', but just timeless being. This is a legacy from a unique teacher who helps the reader to a clearer understanding of himself.",1999,4.51,531
17,Night Lives,Nine Stories of the Dark Fantastic,Phyllis Eisenstein;Alex Eisenstein,Fiction,http://books.google.com/books/content?id=VOgBAAAACAAJ&printsec=frontcover&img=1&zoom=1&source=gbs_api,Presents a collection of nine short works of speculative fiction.,2003,4.5,307
18,Learning to Love,Exploring Solitude and Freedom,Thomas Merton,Religion,http://books.google.com/books/content?id=U0nXswEACAAJ&printsec=frontcover&img=1&zoom=1&source=gbs_api,"Having embraced a life of solitude in his own hermitage, Thomas Merton finds his faith tested beyond his imagination when a visit to the hospital leads to a clandestine affair of the heart. Jolted out of his comfortable routine, Merton is forced to reassess his need for love and his commitment to celibacy and the monastic vocation.This astonishing volume traces Merton’s struggle to reconcile his unexpected love with his sacred vows while continuing to grapple with the burning social issues of the day – including racial conflicts, the war in Vietnam, and the Arab-Israeli conflict – visiting and corresponding with high-profile friends like Thich Nhat Hanh and Joan Baez, and further developing his writing career. Revealing Merton to be ‘very human’ in his chronicles of the ecstasy and torment of being in love, Learning to Love comes full circle as Merton recommits himself completely and more deeply to his vocation even as he recognizes ‘my need for love, my loneliness, my inner division, the struggle in which solitude is at once a problem and a ‘solution’. And perhaps not a perfect solution either’ (11 May, 1967).",1998,4.5,382
19,Children's Christmas Stories and Poems,In Easy-to-Read Type,Candace Ward,Juvenile Fiction,http://books.google.com/books/content?id=Iv4nK-EmQ3wC&printsec=frontcover&img=1&zoom=1&source=gbs_api,"A shortened version of Dicken's ""A Christmas Carol"" is accompanied by Christmas stories, poems, and songs",2011,4.5,96
20,"The Collected Letters of C.S. Lewis, Volume 3","Narnia, Cambridge, and Joy, 1950 - 1963",C. S. Lewis,Biography & Autobiography,http://books.google.com/books/content?id=BCc6Aq5JaJoC&printsec=frontcover&img=1&zoom=1&source=gbs_api,"A final installment of a three-volume series is comprised of personal correspondences as penned during the final part of his life, a time during which he passed his days at Cambridge and wrote the Narnia chronicles.",2004,4.49,1840
21,The Fate of Reason,German Philosophy from Kant to Fichte,Frederick C. Beiser,Philosophy,http://books.google.com/books/content?id=3QUVngEACAAJ&printsec=frontcover&img=1&zoom=1&source=gbs_api,"The Fate of Reason is the first general history devoted to the period between Kant and Fichte, one of the most revolutionary and fertile in modern philosophy. The philosophers of this time broke with the two central tenets of the modem Cartesian tradition: the authority of reason and the primacy of epistemology. They also witnessed the decline of the Aufkldrung, the completion of Kant's philosophy, and the beginnings of post-Kantian idealism. Thanks to Beiser we can newly appreciate the influence of Kant's critics on the development of his philosophy. Beiser brings the controversies, and the personalities who engaged in them, to life and tells a story that has uncanny parallels with the debates of the present.",1993,4.49,410
22,Diary Of Virginia Woolf Volume 5,Vol. 5 (1936-1941),Virginia Woolf,Biography & Autobiography,http://books.google.com/books/content?id=cbAnAQAAMAAJ&printsec=frontcover&img=1&zoom=1&source=gbs_api,"Virginia Woolf was fifty-four on January 25, 1936, some three weeks after this final volume of her diary opens. Its last page was written four days before she drowned herself on March 28, 1941. Edited by Anne Olivier Bell, assisted by Andrew McNeillie; Index; maps.",1985,4.49,424
23,"Harry Bosch Novels, The: Volume 2","The Last Coyote, Trunk Music, Angels Flight",Michael Connelly,Fiction,http://books.google.com/books/content?id=rnDHlgEACAAJ&printsec=frontcover&img=1&zoom=1&source=gbs_api,"The Last Coyote: LAPD homicide detective Harry Bosch is suspended from the force for attacking his commanding officer. Unable to remain idle, he investigates the long-unsolved murder of a Hollywood prostitute. Trunk Music: Harry returns to the force to investigate the murder of a movie producer with Mafia ties. Up against both the LAPD's organized crime unit and the mob, Harry follows the money trail to Las Vegas, where the case becomes personal. Angels Flight: The murder of a prominent African-American attorney who made his career suing the police for racism and brutality means that Harry's friends and associates have become suspects; and he must work closely with longtime enemies suspicious of his maverick ways to investigate them. Together for the first time, these three chilling, pulse-pounding novels chart the volatile, breakneck career of the sleuth the New York Post calls ""the quintessential mystery book hero"" and prove that ""Michael Connelly's Harry Bosch novels are the most impressive body of work by any writer of crime thrillers now active"" (Washington Post).",2003,4.48,821
24,Harry Potter and Philosophy,If Aristotle Ran Hogwarts,David Baggett;Shawn Klein;William Irwin,Fiction,http://books.google.com/books/content?id=Gz8t2MttEQUC&printsec=frontcover&img=1&zoom=1&edge=curl&source=gbs_api,"Urging readers of the Harry Potter series to dig deeper than wizards, boggarts, and dementors, the authors of this unique guide collect the musings of seventeen philosophers on the series, who cover a wide range of Potter-related philosophical issues, including the difference between good and evil, the ethics of sorcery, and Aristotle's own school for wizards. Original.",2004,4.48,243
25,Seabiscuit,The Saga of a Great Champion,B. K. Beckwith,Biography & Autobiography,http://books.google.com/books/content?id=DkFWAAAAYAAJ&printsec=frontcover&img=1&zoom=1&source=gbs_api,"Through first-hand accounts, chronicles the story of the legendary thoroughbred from his birth in Kentucky to his victory at Santa Anita, including anecdotes about the horse and those who cared for him.",2003,4.46,64
26,God's Generals,Why They Succeeded and why Some Failed,Roberts Liardon,Biography & Autobiography,http://books.google.com/books/content?id=jzUDAAAACAAJ&printsec=frontcover&img=1&zoom=1&source=gbs_api,"Recapture God's glory with twelve compelling spiritual biographies of some of the most powerful ministers to ever ignite the fires of revival! Revealing photographs help chronicle the lives of Aimee Sempte McPherson Smith Wigglesworth, Kathryn Kuhlman, William Seymour, and eight others. Draw crucial life applications for yourself from the lives of these mighty warriors.",2003,4.45,416
27,Always Enough,God's Miraculous Provision Among the Poorest Children on Earth,Rolland Baker;Heidi Baker,Religion,http://books.google.com/books/content?id=oPYCNFCUbGwC&printsec=frontcover&img=1&zoom=1&source=gbs_api,"Discover God's modern miracles on the mission field in Mozambique--and how you, too, can experience his limitless love and power!",2003,4.45,192
28,Lover Awakened,A Novel of the Black Dagger Brotherhood,J. R. Ward,Fiction,http://books.google.com/books/content?id=FoubDwAAQBAJ&printsec=frontcover&img=1&zoom=1&source=gbs_api,"When Zsadist, the most feared member of the Black Dagger Brotherhood, rescues Bella from the evil Lessening Society, he is nearly driven insane by rage against her tormentors, and must confront his tortured past in order to have a future with this brave beauty who is his destiny. Original.",2006,4.45,448
29,Stars in Their Courses,"The Gettysburg Campaign, June-July 1863",Shelby Foote,History,http://books.google.com/books/content?id=vLza8sd4PXUC&printsec=frontcover&img=1&zoom=1&source=gbs_api,Recreates the Battle of Gettysburg from both the Confederate and Union perspectives,1994,4.45,304
30,More Plums in One,"Four to Score, High Five, and Hot Six",Janet Evanovich,Fiction,http://books.google.com/books/content?id=WeNcjH3eGpIC&printsec=frontcover&img=1&zoom=1&source=gbs_api,"In a compilation of three novels, a bail jumper is pursued with the help of an ex-prostitute and a transvestite, the search for Stephanie's uncle is hampered by her gun-toting grandma, and Ranger disappears after being accused of murder.",2007,4.44,792
31,The Two Towers,Being the Second Part of The Lord of the Rings,John Ronald Reuel Tolkien,Fiction,http://books.google.com/books/content?id=Bv6FxN76KeQC&printsec=frontcover&img=1&zoom=1&source=gbs_api,"The standard hardcover edition of the second volume of The Lord of the Rings includes a large format fold-out map. Frodo and his Companions of the Ring have been beset by danger during their quest to prevent the Ruling Ring from falling into the hands of the Dark Lord by destroying it in the Cracks of Doom. They have lost the wizard, Gandalf, in a battle in the Mines of Moria. And Boromir, seduced by the power of the Ring, tried to seize it by force. While Frodo and Sam made their escape, the rest of the company was attacked by Orcs. Now they continue the journey alone down the great River Anduin -- alone, that is, save for the mysterious creeping figure that follows wherever they go.",1994,4.44,328
32,The Two Towers,Being the Second Part of The Lord of the Rings,John Ronald Reuel Tolkien,Fiction,http://books.google.com/books/content?id=wpCBdbLSmLcC&printsec=frontcover&img=1&zoom=1&source=gbs_api,"After losing Gandalf and being divided from their other companions during an Orc attack, Frodo and Sam continue towards Mordor, Land of the Enemy, to destroy the Ring, accompanied only by a mysterious figure that follows them.",2004,4.44,413
33,The Border Trilogy,Picador Classic,Cormac McCarthy,Fiction,http://books.google.com/books/content?id=QeGjwgEACAAJ&printsec=frontcover&img=1&zoom=1&source=gbs_api,"Cormac McCarthy’s award-winning, bestselling trio of novels chronicles the coming-of-age of two young men in the south west of America. John Grady Cole and Billy Parham, two cowboys of the old school, are poised on the edge of a world about to change forever. Their journeys across the border into Mexico, each an adventure fraught with fear and pain, mark a passage into adulthood, and eventual salvation. In All the Pretty Horses, young John Grady Cole, dispossessed by the sale of his family’s Texas ranch, heads across the border in search of the cowboy life, where he finds a job breaking horses, and a dangerously ill-fated romance. In The Crossing, sixteen-year-old Billy Parham captures a wolf that has been marauding his family’s ranch and, instead of killing it, decides to take it on a perilous journey home to the mountains of Mexico.These two drifters come together years later in Cities of the Plain, a magnificent tale of friendship and passion. In the vanishing world of the Old West, blood and violence are conditions of life. Beautiful and brutal, filled with sorrow and humour, The Border Trilogy is both an epic love story and a fierce elegy for the American frontier.",2002,4.43,1038
34,Tucket's Travels,"Francis Tucket's Adventures in the West, 1847-1849",Gary Paulsen,Juvenile Fiction,http://books.google.com/books/content?id=M6Ru21OibroC&printsec=frontcover&img=1&zoom=1&source=gbs_api,"Francis Tucket, traveling the Oregon trail on a wagon, has many adventures after being kidnapped by Pawnee Indians, including meeting a one-armed man, rescuing abandoned children, and enduring bandits and fierce storms on his trek home.",2003,4.43,560
35,C. S. Lewis,"Life, Works, and Legacy",Bruce L. Edwards,Literary Criticism,http://books.google.com/books/content?id=mAL6V-aM7KkC&printsec=frontcover&img=1&zoom=1&edge=curl&source=gbs_api,"Examines the life and works of the British author and scholar, best known for his creation of ""The Chronicles of Narnia"" series.",2007,4.43,1416
36,"History of Religious Ideas, Volume 3",From Muhammad to the Age of Reforms,Mircea Eliade,Religion,http://books.google.com/books/content?id=rB6jwAEACAAJ&printsec=frontcover&img=1&zoom=1&source=gbs_api,"This volume completes the immensely learned three-volume A History of Religious Ideas. Eliade examines the movement of Jewish thought out of ancient Eurasia, the Christian transformation of the Mediterranean area and Europe, and the rise and diffusion of Islam from approximately the sixth through the seventeenth centuries. Eliade's vast knowledge of past and present scholarship provides a synthesis that is unparalleled. In addition to reviewing recent interpretations of the individual traditions, he explores the interactions of the three religions and shows their continuing mutual influence to be subtle but unmistakable. As in his previous work, Eliade pays particular attention to heresies, folk beliefs, and cults of secret wisdom, such as alchemy and sorcery, and continues the discussion, begun in earlier volumes, of pre-Christian shamanistic practices in northern Europe and the syncretistic tradition of Tibetan Buddhism. These subcultures, he maintains, are as important as the better-known orthodoxies to a full understanding of Judaism, Christianity, and Islam.",1988,4.43,367
37,Band of Brothers,"E Company, 506th Regiment, 101st Airborne from Normandy to Hitler's Eagle's Nest",Stephen E. Ambrose,History,http://books.google.com/books/content?id=jlFL20cX9HIC&printsec=frontcover&img=1&zoom=1&edge=curl&source=gbs_api,"Through soldiers' journals and letters, describes Easy Company's contributions to the campaigns in western Europe and recounts their stories of survival.",2002,4.43,432
38,The Last Lion,"Winston Spencer Churchill - Visions of Glory, 1874-1932",William Manchester,Biography & Autobiography,http://books.google.com/books/content?id=uxOzxgEACAAJ&printsec=frontcover&img=1&zoom=1&source=gbs_api,Describes the early life and political career of the British prime minister.,1984,4.43,992
39,The Glory and the Dream,"A Narrative History of America, 1932-1972",William Manchester,History,http://books.google.com/books/content?id=f9dOPQAACAAJ&printsec=frontcover&img=1&zoom=1&source=gbs_api,"Explore's American history from the Great Depression, through two World Wars and Korea to the anti-war protests of Vietnam",1990,4.42,1397
