id,title,subtitle,authors,categories,thumbnail,description,published_year,average_rating,num_pages
40,Myths of Light,Eastern Metaphors of the Eternal,Joseph Campbell,Philosophy,http://books.google.com/books/content?id=OWdqt29UDGYC&printsec=frontcover&img=1&zoom=1&edge=curl&source=gbs_api,"This previously unpublished title shows Campbell's remarkable mind engaged with a favorite topic, the myths and metaphors of Asian religions. The book collects seven lectures and articles ranging from the ancient Hindu Vedas to Zen koans, Tantric yoga, and the Tibetan Book of the Dead. Campbell conveys complex insights through warm, accessible storytelling, revealing the intricacies and secrets of his subjects with his typical enthusiasm.--From publisher description.",2003,4.42,224
41,"""Gorgias"" and ""Phaedrus""","Rhetoric, Philosophy, and Politics",Plato,Philosophy,http://books.google.com/books/content?id=vBmKQgAACAAJ&printsec=frontcover&img=1&zoom=1&source=gbs_api,"With a masterful sense of the place of rhetoric in both thought and practice and an ear attuned to the clarity, natural simplicity, and charm of Plato's Greek prose, James H. Nichols Jr., offers precise yet unusually readable translations of two great Platonic dialogues on rhetoric. The Gorgias presents an intransigent argument that justice is superior to injustice: To the extent that suffering an injustice is preferable to committing an unjust act. The dialogue contains some of Plato's most significant and famous discussions of major political themes, and focuses dramatically and with unrivaled intensity on Socrates as a political thinker and actor. Featuring some of Plato's most soaringly lyrical passages, the Phaedrus investigates the soul's erotic longing and its relationship to the whole cosmos, as well as inquiring into the nature of rhetoric and the problem of writing. Nichols's attention to dramatic detail brings the dialogues to life. Plato's striking variety in conversational address (names and various terms of relative warmth and coolness) is carefully reproduced, as is alteration in tone and implication even in the short responses. The translations render references to the gods accurately and non-monotheistically for the first time, and include a fascinating variety of oaths and invocations. A general introduction on rhetoric from the Greeks to the present shows the problematic relation of rhetoric to philosophy and politics, states the themes that unite the two dialogues, and outlines interpretive suggestions that are then developed more fully for each dialogue. The twin dialogues reveal both the private and the political rhetoric emphatic in Plato's philosophy, yet often ignored in commentaries on it. Nichols believes that Plato's thought on rhetoric has been largely misunderstood, and he uses his translations as an opportunity to reconstruct the classical position on right relations between thought and public activity.",1998,4.41,233
42,Blink-182,Tales from Beneath Your Mom,Blink-182;Anne Hoppus;Tom Delonge;Mark Hoppus;Travis Barker,Biography & Autobiography,http://books.google.com/books/content?id=CzH6_3CiNMYC&printsec=frontcover&img=1&zoom=1&source=gbs_api,"Presents a behind-the-scenes look at the band, including their life on the road, videos, and backstage antics.",2001,4.4,112
43,Shattered Sword,The Untold Story of the Battle of Midway,Jonathan B. Parshall;Anthony P. Tully,History,http://books.google.com/books/content?id=krvlaQ5PQOQC&printsec=frontcover&img=1&zoom=1&edge=curl&source=gbs_api,"Told from the Japanese perspective, using largely Japanese sources, this volume represents the first substantive contribution to the West's understanding of Midway in more than a generation.",2005,4.4,612
44,Plato in twelve volumes,Symposium ; Gorgias. Lysis,Plato,Literary Criticism,http://books.google.com/books/content?id=tRaDAAAAIAAJ&printsec=frontcover&img=1&zoom=1&source=gbs_api,"Plato, the great philosopher of Athens, was born in 427 BCE. In early manhood an admirer of Socrates, he later founded the famous school of philosophy in the grove Academus. Much else recorded of his life is uncertain; that he left Athens for a time after Socrates' execution is probable; that later he went to Cyrene, Egypt, and Sicily is possible; that he was wealthy is likely; that he was critical of 'advanced' democracy is obvious. He lived to be 80 years old. Linguistic tests including those of computer science still try to establish the order of his extant philosophical dialogues, written in splendid prose and revealing Socrates' mind fused with Plato's thought. In Laches, Charmides, and Lysis, Socrates and others discuss separate ethical conceptions. Protagoras, Ion, and Meno discuss whether righteousness can be taught. In Gorgias, Socrates is estranged from his city's thought, and his fate is impending. The Apology (not a dialogue), Crito, Euthyphro, and the unforgettable Phaedo relate the trial and death of Socrates and propound the immortality of the soul. In the famous Symposium and Phaedrus, written when Socrates was still alive, we find the origin and meaning of love. Cratylus discusses the nature of language. The great masterpiece in ten books, the Republic, concerns righteousness (and involves education, equality of the sexes, the structure of society, and abolition of slavery). Of the six so-called dialectical dialogues Euthydemus deals with philosophy; metaphysical Parmenides is about general concepts and absolute being; Theaetetus reasons about the theory of knowledge. Of its sequels, Sophist deals with not-being; Politicus with good and bad statesmanship and governments; Philebus with what is good. The Timaeus seeks the origin of the visible universe out of abstract geometrical elements. The unfinished Critias treats of lost Atlantis. Unfinished also is Plato's last work of the twelve books of Laws (Socrates is absent from it), a critical discussion of principles of law which Plato thought the Greeks might accept. The Loeb Classical Library edition of Plato is in twelve volumes.",1975,4.39,560
45,Stormie,A Story of Forgiveness and Healing,Stormie Omartian,Biography & Autobiography,http://books.google.com/books/content?id=3K7EjGtQ4aEC&printsec=frontcover&img=1&zoom=1&edge=curl&source=gbs_api,"When Catechism of the Catholic Church broke onto the N.Y. Times bestseller list, its astonishing success confirmed the overwhelming interest of Catholics and Protestants in understanding modern Catholicism. Has the recent openness among denominations affected Catholic teachings? In the new spirit of cooperation, is there any reason why Catholics and Protestants should remain divided? This powerful and insightful examination of the Catholic Church provides: a side-by-side comparison of Scripture with the first new worldwide Catholic catechism in 400 years a summary of how modern Catholicism views grace, works, and heaven 24 ways the Catholic plan of salvation still stands in contrast to biblical truth a balanced overview of how the authority structure of the Roman Catholic Church compares with that of the New Testament church an explanation of how participation in the Mass and other sacraments is inconsistent with faith in Christ as Savior Clear, accurate, significant information to know and share--The Gospel According to Rome",1997,4.39,192
46,Selections from Homer's Iliad,"With an Introduction, Notes, a Short Homeric Grammar, and a Vocabulary",Homer,Literary Criticism,http://books.google.com/books/content?id=nY-5r76h7SwC&printsec=frontcover&img=1&zoom=1&edge=curl&source=gbs_api,"First published in 1903, Selections from Homer's Iliad has become a classic Greek textbook. Allen Rogers Benner presents selections from twelve books of the Iliad in both Greek and English and short summaries that help students understand the Iliad as a work of literature and art.",2001,4.39,522
47,Maus II,a survivor's tale : and here my troubles began,Art Spiegelman,Biography & Autobiography,http://books.google.com/books/content?id=2hGxd5wQhRsC&printsec=frontcover&img=1&zoom=1&source=gbs_api,"In a comic-book-style tale of the author's parents, Vladek and Anja, Vladek survives Auschwitz, is reunited with Anja, and sires young Art",1991,4.39,144
48,Enchanted Evening,Volume III of the Autobiography of M. M. Kaye,M. M. Kaye,Biography & Autobiography,http://books.google.com/books/content?id=tsNdSys-9FMC&printsec=frontcover&img=1&zoom=1&source=gbs_api,"The author concludes her autobiography with stories of her life in England, India, and China in the years between the two World Wars.",2000,4.38,368
49,Where the Red Fern Grows,The Story of Two Dogs and a Boy : with Connections,Wilson Rawls,Juvenile Fiction,http://books.google.com/books/content?id=IHpRwgEACAAJ&printsec=frontcover&img=1&zoom=1&source=gbs_api,A young boy living in the Ozarks achieves his heart's desire when he becomes the owner of two redbone hounds and teaches them to be champion hunters.,2000,4.37,288
50,Shakespeare A to Z,"The Essential Reference to His Plays, His Poems, His Life and Times, and More",Charles Boyce;David Allen White,Drama,http://books.google.com/books/content?id=FxgBAAAACAAJ&printsec=frontcover&img=1&zoom=1&source=gbs_api,"Brer Rabbit will never learn! He loves to play jokes, tricks and set traps for his friends - but once in a while, they beat him at his own game! These timeless stories of the briar patch trickster are re-told in Blyton's hugely popular and successful style. This collection contains many Brer Rabbit stories from the books Enid Blyton's Brer Rabbit Book, Brer Rabbit Again and Brer Rabbit's a Rascal.",1991,4.35,752
51,Epictetus,"the Discourses as reported by Arrian, the Manual, and fragments",Epictetus,Philosophy,http://books.google.com/books/content?id=ya9fAAAAMAAJ&printsec=frontcover&img=1&zoom=1&source=gbs_api,"These volumes contain the teachings (""Discourses"") of the slave-philosopher Epictetus (55 A.D-135 AD). Also included in volume 2 are ""Fragments"", additional pieces from other (now lost) books of the ""Discourses""; and ""The Encheirdion"", a collection of practical precepts for stoicism which can be seen as a handbook for life.",1967,4.35,576
52,Battle Cry of Freedom,The Civil War Era,James M. McPherson,History,http://books.google.com/books/content?id=09FkZqu_YcMC&printsec=frontcover&img=1&zoom=1&source=gbs_api,"Filled with fresh interpretations and information, puncturing old myths and challenging new ones, Battle Cry of Freedom will unquestionably become the standard one-volume history of the Civil War. James McPherson's fast-paced narrative fully integrates the political, social, and military events that crowded the two decades from the outbreak of one war in Mexico to the ending of another at Appomattox. Packed with drama and analytical insight, the book vividly recounts the momentous episodes that preceded the Civil War—the Dred Scott decision, the Lincoln-Douglas debates, John Brown's raid on Harper's Ferry—and then moves into a masterful chronicle of the war itself—the battles, the strategic maneuvering on both sides, the politics, and the personalities.",2005,4.34,867
53,A Farewell to Arms?,"Beyond the Good Friday Agreement, Second Edition",Michael Cox;Adrian Guelke;Fiona Stephen,History,http://books.google.com/books/content?id=G5wuwrmrdWoC&printsec=frontcover&img=1&zoom=1&edge=curl&source=gbs_api,"Neither naively optimistic nor hopelessley pessimistic, this collection of writings by experts on the history of the troubles in Northern Ireland paints a realistic picture of the peace processes that have dotted the province's landscape.",2006,4.33,624
54,Mapping the World of Harry Potter,Science Fiction and Fantasy Writers Explore the Best Selling Fantasy Series of All Time,Mercedes Lackey;Leah Wilson,Literary Criticism,http://books.google.com/books/content?id=Vbn7ugEACAAJ&printsec=frontcover&img=1&zoom=1&source=gbs_api,"Presents a collection of critiques of the works of J. K. Rowling, covering the topics and characters found in the Harry Potter books.",2006,4.32,195
55,Six Frigates,The Epic History of the Founding of the U.S. Navy,Ian W. Toll,History,http://books.google.com/books/content?id=q9xfGcwEEqMC&printsec=frontcover&img=1&zoom=1&source=gbs_api,"Describes the origins and early history of the American Navy, discussing the debates by the founding fathers over the need for a permanent military, the decision to construct six heavy frigates, the campaign against Tripoli, and the war of 1812, including the confrontation between the USS Constitution and HMS Guerriere that raised the U.S. to a global power. 70,000 first printing.",2006,4.32,560
56,Japan at War,An Oral History,Haruko Taya Cook;Theodore F. Cook,History,http://books.google.com/books/content?id=rbqEQgAACAAJ&printsec=frontcover&img=1&zoom=1&source=gbs_api,"Recounts the conflict and documents the huge range of experiences by Japanese soldiers, laborers, journalists, artists, musicians, and women who lived through World War II",1992,4.32,493
57,The Code Book,The Science of Secrecy from Ancient Egypt to Quantum Cryptography,Simon Singh,History,http://books.google.com/books/content?id=skt7TrLK5uYC&printsec=frontcover&img=1&zoom=1&source=gbs_api,"Includes a history of how codes have affected the world, from the World Wars to the death of Mary, Queen of Scots, and also looks at what the future holds for the field of cryptography.",2000,4.31,412
58,The Writer of Modern Life,Essays on Charles Baudelaire,Walter Benjamin,Literary Criticism,http://books.google.com/books/content?id=H5P5SM0gNYUC&printsec=frontcover&img=1&zoom=1&edge=curl&source=gbs_api,"In these essays, Benjamin challenges the image of Baudelaire as late-Romantic dreamer, and evokes instead the modern poet caught in a life-or-death struggle with the forces of the urban commodity capitalism that had emerged in Paris around 1850.",2006,4.3,307
59,Tom Stoppard: Plays 5,"Aracadia, The Real Thing, Night & Day, Indian Ink, Hapgood",Tom Stoppard,Drama,http://books.google.com/books/content?id=sR0YSeUweGwC&printsec=frontcover&img=1&zoom=1&source=gbs_api,"Plays Five: Arcadia The Real Thing Night & Day Indian Ink Hapgood This fifth collection of Tom Stoppard's plays brings together five classic plays by one of the most celebrated dramatists writing in the English language. Arcadia received the Evening Standard, the Oliver, and the Critics Awards and The Real Thing won a Tony Award.",1999,4.3,608
60,Tsubasa,vol. 7,CLAMP (Mangaka group),Juvenile Fiction,http://books.google.com/books/content?id=kuh6tAEACAAJ&printsec=frontcover&img=1&zoom=1&source=gbs_api,"Sakura, the princess of Clow, has a strange power that could change the world, and lives in an alternate-reality world with her childhood friend Syaoran, with whom she begins a series of journeys to other worlds.",2005,4.29,194
61,Moon in a Dewdrop,Writings of Zen Master Dogen,Dōgen;Zen Master Dogen,Philosophy,http://books.google.com/books/content?id=af-BZb7n9P8C&printsec=frontcover&img=1&zoom=1&source=gbs_api,"Eihei Dogen (1200-1253), among the first to transmit Zen Buddhism from China to Japan and founder of the important Soto School, was not only a profoundly influential and provocative Zen philosopher but also one of the most stimulating figures in Japanese letters. Kazuaki Tanahashi, collaborating with several other Zen authorities, has produced sensitive and accurate translations of Dogen's most important texts. Moon in a Dewdrop contains the key essays of the great master, as well as extensive background materials that will help Western readers to approach this significant work. There is also a selection of Dogen's poetry, most of which has not appeared in English translation before. Dogen's thought runs counter to conventional logic, employing paradoxical language and startling imagery. It illuminates such fundamental concerns as the nature of time, existence, life, death, the self, and what is beyond self.",1985,4.29,368
62,The Gramsci Reader,"Selected Writings, 1916-1935",Antonio Gramsci,Philosophy,http://books.google.com/books/content?id=nl_bJyeYdpwC&printsec=frontcover&img=1&zoom=1&source=gbs_api,"with a new introduction by ERIC J. HOBSBAWM ""Very usefully pulls the key passages from Gramsci's writings into one volume, which allows English-language readers an overall view of his work. Particularly valuable are the connections it draws across his work and the insights which the introduction and glossary provide into the origin and development of some key Gramscian concepts."" --Stuart Hall, Professor of Sociology, Open University The most complete one-volume collection of writings by one of the most fascinating thinkers in the history of Marxism, The Antonio Gramsci Reader fills the need for a broad and general introduction to this major figure. Antonio Gramsci was one of the most important theorists of class, culture, and the state since Karl Marx. In the U.S., where his writings were long unavailable, his stature has lately so increased that every serious student of Marxism, political theory, or modern Italian history must now read him. Imprisoned by the Fascists for much of his adult life, Gramsci wrote brilliantly on a broad range of subjects: from folklore to philosophy, popular culture to political strategy. Still the most comprehensive collection of Gramsci's writings available in English, it now features a new introduction by leading Marxist historian Eric Hobsbawm, in addition to its biographical introduction, informative introductions to each section, and glossary of key terms.",2000,4.28,447
63,Regeneration Through Violence,"The Mythology of the American Frontier, 1600-1860",Richard Slotkin,Literary Criticism,http://books.google.com/books/content?id=552NfCm3-WwC&printsec=frontcover&img=1&zoom=1&edge=curl&source=gbs_api,"Originally published: Middletown, Conn.: Wesleyan University Press, 1973.",2000,4.28,670
64,In Harm's Way,The Sinking of the U.S.S. Indianapolis and the Extraordinary Story of Its Survivors,Doug Stanton,History,http://books.google.com/books/content?id=oBaI6MnPHxcC&printsec=frontcover&img=1&zoom=1&source=gbs_api,"Chronicles the worst disaster in U.S. naval history, describing heroism in the face of persistant shark attacks and hypothermia after the sinking of the U.S.S. Indianapolis in the South Pacific in the final days of World War II.",2003,4.28,384
65,The Truth,Stage Adaptation,Terry Pratchett,Drama,http://books.google.com/books/content?id=3fmdQgAACAAJ&printsec=frontcover&img=1&zoom=1&source=gbs_api,"A new stage adaptation of one of Pratchett's best-selling novels There's been a murder. Allegedly. William de Worde is the Discworld's first investigative journalist. He didn't mean to be - it was just an accident. But, as William fills his pages with reports of local club meetings and pictures of humorously shaped vegetables, dark forces high up in Ankh-Morpork's society are plotting to overthrow the city's ruler, Lord Vetinari.",2002,4.28,336
66,The Lord of the Rings and Philosophy,One Book to Rule Them All,Gregory Bassham;Eric Bronson,Literary Criticism,http://books.google.com/books/content?id=4g4BAwAAQBAJ&printsec=frontcover&img=1&zoom=1&edge=curl&source=gbs_api,"Culls dozens of life lessons from the pages of J.R.R. Tolkien's epic tale, examining the author's treatment of such issues as happiness, morality, and the search for ultimate truth.",2003,4.28,240
67,The Power of One,"One Person, One Rule, One Month",John C. Maxwell;Thomas G. Addington,Business & Economics,http://books.google.com/books/content?id=L_FGsSyk2PkC&printsec=frontcover&img=1&zoom=1&source=gbs_api,"In this 30-day companion workbook to There's No Such Thing as ""Business"" Ethics, bestselling author John C. Maxwell demonstrates how we can live with integrity by using the Golden Rule as our standard-in business and in life. In fact, Maxwell suggests the higher standard of exceeding the Golden Rule-by treating people better than they treat us, helping those who cannot help us, doing right when it is natural to do wrong, and keeping promises, even when it hurts. An ethics guide for any situation, each ""day"" of The Power of One offers a Drilling Down section which features a case study or story that illustrates the day's topic, Summarizing Principles on the subject, penetrating questions for Making Evaluation, and points of application for Taking Action. Maxwell reveals the factors that can ""tarnish"" the Golden Rule and teaches how to develop the Midas touch in personal integrity.",2004,4.28,256
68,Stephen Hawking's Universe,The Cosmos Explained,David Filkin,Science,http://books.google.com/books/content?id=Q1XgUZzNFGoC&printsec=frontcover&img=1&zoom=1&source=gbs_api,"Stephen Hawking's A Brief History of Time has sold over 9 million copies worldwide. Now, in everyday language, Stephen Hawking's Universe reveals step-by-step how we can all share his understanding of the cosmos, and our own place within it. Stargazing has never been the same since cosmologists discovered that galaxies are moving away from each other at an extraordinary speed. It was this understanding of the movement of galaxies that allowed scientists to develop a theory of how the universe was created—the Big Bang theory. Working with this theory, Stephen Hawking and other physicists felt challenged to come up with a scientific picture that would tackle the fundamental question: what is the nature of the universe? Stephen Hawking's Universe charts this work and provides simple explanations for phenomena that arouse our curiosity. This work is a voyage of discovery with an astonishing set of conclusions that will enable us to understand how matter can be produced from nothing at all and will provide us with an explanation for the basis of our existence and that of everything around us.",1998,4.28,304
69,Modern Mind,An Intellectual History of the 20th Century,Peter Watson,Science,http://books.google.com/books/content?id=JVdMSavwwHoC&printsec=frontcover&img=1&zoom=1&source=gbs_api,"From Freud to Babbitt, from Animal Farm to Sartre to the Great Society, from the Theory of Relativity to counterculture to Kosovo, The Modern Mind is encyclopedic, covering the major writers, artists, scientists, and philosophers who produced the ideas by which we live. Peter Watson has produced a fluent and engaging narrative of the intellectual tradition of the twentieth century, and the men and women who created it.",2002,4.27,847
70,Hamlet's Mill,An Essay on Myth and the Frame of Time,Giorgio De Santillana;Hertha von Dechend,Philosophy,http://books.google.com/books/content?id=ql7ATHGee50C&printsec=frontcover&img=1&zoom=1&edge=curl&source=gbs_api,"Ever since the Greeks coined the language we commonly use for scientific description, mythology and science have developed separately. But what came before the Greeks? What if we could prove that all myths have one common origin in a celestial cosmology? What if the gods, the places they lived, and what they did are but ciphers for celestial activity, a language for the perpetuation of complex astronomical data? Drawing on scientific data, historical and literary sources, the authors argue that our myths are the remains of a preliterate astronomy, an exacting science whose power and accuracy were suppressed and then forgotten by an emergent Greco-Roman world view. This fascinating book throws into doubt the self-congratulatory assumptions of Western science about the unfolding development and transmission of knowledge. This is a truly seminal and original thesis, a book that should be read by anyone interested in science, myth, and the interactions between the two.",1977,4.27,450
71,Alanna,The First Adventure,Tamora Pierce,Juvenile Fiction,http://books.google.com/books/content?id=_uvOvgEACAAJ&printsec=frontcover&img=1&zoom=1&source=gbs_api,"""From now on I'm Alan of Trebond, the younger twin. I'll be a knight."" And so young Alanna of Trebond begins the journey to knighthood. Though a girl, Alanna has always craved the adventure and daring allowed only for boys; her twin brother, Thom, yearns to learn the art of magic. So one day they decide to switch places: Disguised as a girl, Thom heads for the convent to learn magic; Alanna, pretending to be a boy, is on her way to the castle of King Roald to begin her training as a page. But the road to knighthood is not an easy one. As Alanna masters the skills necessary for battle, she must also learn to control her heart and to discern her enemies from her allies. Filled with swords and sorcery, adventure and intrigue, good and evil, Alanna's first adventure begins -- one that will leard to the fulfillment of her dreams and the magical destiny that will make her a legend in her land. Alanna's journey continues...",2005,4.27,274
72,New Threads in the Pattern,The Great Hunt,Robert Jordan,Juvenile Fiction,http://books.google.com/books/content?id=tSuNpN0SXFoC&printsec=frontcover&img=1&zoom=1&source=gbs_api,"Rand a'Thor, the Dragon Reborn, continues his unlikely quest in these next chapters of Jordan's incredibly popular, award-winning Wheel of Time series. Reissue.",2004,4.27,464
73,Little Pilgrim's Progress,From John Bunyan's Classic,Helen L. Taylor,Juvenile Fiction,http://books.google.com/books/content?id=lxBomAEACAAJ&printsec=frontcover&img=1&zoom=1&source=gbs_api,Presents an allegorical account of the Christian journey through life.,2006,4.25,336
74,The Pleasure of Finding Things Out,The Best Short Works of Richard P. Feynman,Richard Phillips Feynman,Science,http://books.google.com/books/content?id=s6LzV_U6PskC&printsec=frontcover&img=1&zoom=1&source=gbs_api,A collection of short works by the noted scientist includes his report on the space shuttle Challenger disaster and his Nobel Prize acceptance speech.,1999,4.25,270
75,Shakespeare's Sonnets,Third Series,William Shakespeare,Drama,http://books.google.com/books/content?id=eMBwueQHR_UC&printsec=frontcover&img=1&zoom=1&edge=curl&source=gbs_api,No Marketing Blurb,1997,4.25,488
